{
  "correction_id": "bulk-obsolete-0fyi-gpt6astra-20261015",
  "created_at": "2026-10-16T05:09:08.940424Z",
  "derivation_ids": {
    "tag:0FYI:paragraph-0001": "audit-bulk-obsolete-0fyi-20261015",
    "tag:0FYI:title": "audit-bulk-obsolete-0fyi-20261015",
    "tag:0FYJ:proof": "audit-bulk-obsolete-0fyi-20261015",
    "tag:0FYK:statement": "audit-bulk-obsolete-0fyi-20261015",
    "tag:0FYL:proof": "audit-bulk-obsolete-0fyi-20261015",
    "tag:0FYL:statement": "audit-bulk-obsolete-0fyi-20261015"
  },
  "files": {
    "candidates": {
      "hash": "sha256:f76caf900a1e48243088e422d66b4dabda99efd70dd4c0c51221f392fe69c263",
      "path": "translation-data/retired/model-corrections/bulk-obsolete-0fyi-gpt6astra-20261015/candidates.jsonl"
    },
    "units": {
      "hash": "sha256:c162461ca5ad94df84a0261f69d4c71abac8ec58ba0e057c53ed0578cd4a9b25",
      "path": "translation-data/retired/model-corrections/bulk-obsolete-0fyi-gpt6astra-20261015/units.jsonl"
    }
  },
  "run_id": "run-20261015-bulk-obsolete-0fyi-gpt6astra",
  "schema_version": 1,
  "source_commit": "a04446e57ec1fbc252a871afcec7752fb2807b14",
  "unit_ids": [
    "tag:0FYI:title",
    "tag:0FYI:paragraph-0001",
    "tag:0FYJ:proof",
    "tag:0FYK:statement",
    "tag:0FYL:statement",
    "tag:0FYL:proof"
  ]
}
