{
  "correction_id": "bulk-sets-000d-gpt61sol-20261015",
  "created_at": "2026-10-16T05:09:08.940424Z",
  "derivation_ids": {
    "tag:000D:prose-0001": "audit-bulk-sets-000d-20261015",
    "tag:000D:title": "audit-bulk-sets-000d-20261015"
  },
  "files": {
    "candidates": {
      "hash": "sha256:f8759191df58c1a25309671fdb181e53eca68f18638bd5fd3b5c4b3fcedefbdf",
      "path": "translation-data/retired/model-corrections/bulk-sets-000d-gpt61sol-20261015/candidates.jsonl"
    },
    "units": {
      "hash": "sha256:b04c3d358d19300c54cddc5d61630e5542976ffdb2084799145518578203ac6f",
      "path": "translation-data/retired/model-corrections/bulk-sets-000d-gpt61sol-20261015/units.jsonl"
    }
  },
  "run_id": "run-20261015-bulk-sets-000d-gpt61sol",
  "schema_version": 1,
  "source_commit": "a04446e57ec1fbc252a871afcec7752fb2807b14",
  "unit_ids": [
    "tag:000D:title",
    "tag:000D:prose-0001"
  ]
}
