{
  "correction_id": "bulk-desirables-03mz-gpt61sol-20261015",
  "created_at": "2026-10-16T05:09:08.940424Z",
  "derivation_ids": {
    "tag:03MZ:paragraph-0001": "audit-bulk-desirables-03mz-20261015",
    "tag:03MZ:title": "audit-bulk-desirables-03mz-20261015"
  },
  "files": {
    "candidates": {
      "hash": "sha256:1d525d147f26fd42c085ba728aef6a2d5e11b8ffb0710b0e1c24b42493db448f",
      "path": "translation-data/retired/model-corrections/bulk-desirables-03mz-gpt61sol-20261015/candidates.jsonl"
    },
    "units": {
      "hash": "sha256:4324fbf706616dd0136dd6f83498b1d40df3cf63b4298427f4127f7651821af1",
      "path": "translation-data/retired/model-corrections/bulk-desirables-03mz-gpt61sol-20261015/units.jsonl"
    }
  },
  "run_id": "run-20261015-bulk-desirables-03mz-gpt61sol",
  "schema_version": 1,
  "source_commit": "a04446e57ec1fbc252a871afcec7752fb2807b14",
  "unit_ids": [
    "tag:03MZ:title",
    "tag:03MZ:paragraph-0001"
  ]
}
