{
  "correction_id": "bulk-guide-04v7-gpt61sol-20261015",
  "created_at": "2026-10-16T05:09:08.940424Z",
  "derivation_ids": {
    "tag:04V7:prose-0001": "audit-bulk-guide-04v7-20261015",
    "tag:04V7:title": "audit-bulk-guide-04v7-20261015"
  },
  "files": {
    "candidates": {
      "hash": "sha256:d0d4795fa15b60a32fe05a3bad7dc28ce583c7688238a8f8b71d39fa8346aec2",
      "path": "translation-data/retired/model-corrections/bulk-guide-04v7-gpt61sol-20261015/candidates.jsonl"
    },
    "units": {
      "hash": "sha256:aae8fc52f56f6c4389b19c86ec18db841a6094671d911f80021943291996732a",
      "path": "translation-data/retired/model-corrections/bulk-guide-04v7-gpt61sol-20261015/units.jsonl"
    }
  },
  "run_id": "run-20261015-bulk-guide-04v7-gpt61sol",
  "schema_version": 1,
  "source_commit": "a04446e57ec1fbc252a871afcec7752fb2807b14",
  "unit_ids": [
    "tag:04V7:title",
    "tag:04V7:prose-0001"
  ]
}
