{
  "correction_id": "bulk-categories-04aq-gpt61sol-20261015",
  "created_at": "2026-10-16T05:09:08.940424Z",
  "derivation_ids": {
    "tag:04AQ:paragraph-0001": "audit-bulk-categories-04aq-20261015",
    "tag:04AQ:paragraph-0002": "audit-bulk-categories-04aq-20261015",
    "tag:04AQ:title": "audit-bulk-categories-04aq-20261015"
  },
  "files": {
    "candidates": {
      "hash": "sha256:dc8fa20a5f73cbecc166f72e73671d2bcc99b6b26e41b83b121e88bc3cd09f40",
      "path": "translation-data/retired/model-corrections/bulk-categories-04aq-gpt61sol-20261015/candidates.jsonl"
    },
    "units": {
      "hash": "sha256:e8575a5debed6ca6f5e8d072c09c97803614fa987ef49d8c4cb60c2fb22f075d",
      "path": "translation-data/retired/model-corrections/bulk-categories-04aq-gpt61sol-20261015/units.jsonl"
    }
  },
  "run_id": "run-20261015-bulk-categories-04aq-gpt61sol",
  "schema_version": 1,
  "source_commit": "a04446e57ec1fbc252a871afcec7752fb2807b14",
  "unit_ids": [
    "tag:04AQ:title",
    "tag:04AQ:paragraph-0001",
    "tag:04AQ:paragraph-0002"
  ]
}
