{
  "correction_id": "bulk-extra-categories-02xg-gpt61sol-20261016",
  "created_at": "2026-10-16T05:09:08.940424Z",
  "derivation_ids": {
    "tag:003Y:statement": "audit-bulk-extra-categories-02xg-20261016",
    "tag:0040:proof": "audit-bulk-extra-categories-02xg-20261016",
    "tag:0040:statement": "audit-bulk-extra-categories-02xg-20261016",
    "tag:02XG:paragraph-0001": "audit-bulk-extra-categories-02xg-20261016",
    "tag:02XG:prose-0002": "audit-bulk-extra-categories-02xg-20261016",
    "tag:02XG:prose-0003": "audit-bulk-extra-categories-02xg-20261016",
    "tag:02XG:title": "audit-bulk-extra-categories-02xg-20261016",
    "tag:02XH:statement": "audit-bulk-extra-categories-02xg-20261016",
    "tag:02XI:proof": "audit-bulk-extra-categories-02xg-20261016",
    "tag:02XI:statement": "audit-bulk-extra-categories-02xg-20261016",
    "tag:0H2D:statement": "audit-bulk-extra-categories-02xg-20261016"
  },
  "files": {
    "candidates": {
      "hash": "sha256:76e987915eba3189f63e620c77115a6ce5b21fe11cecd8d4198694d445234e8c",
      "path": "translation-data/retired/model-corrections/bulk-extra-categories-02xg-gpt61sol-20261016/candidates.jsonl"
    },
    "units": {
      "hash": "sha256:385baf8ec16bd4785919abd2599b27d24cb0f5720dbcfdfc0a7be585ee876925",
      "path": "translation-data/retired/model-corrections/bulk-extra-categories-02xg-gpt61sol-20261016/units.jsonl"
    }
  },
  "run_id": "run-20261016-bulk-extra-categories-02xg-gpt61sol",
  "schema_version": 1,
  "source_commit": "a04446e57ec1fbc252a871afcec7752fb2807b14",
  "unit_ids": [
    "tag:02XG:title",
    "tag:02XG:paragraph-0001",
    "tag:003Y:statement",
    "tag:02XG:prose-0002",
    "tag:02XH:statement",
    "tag:02XG:prose-0003",
    "tag:0040:statement",
    "tag:0040:proof",
    "tag:0H2D:statement",
    "tag:02XI:statement",
    "tag:02XI:proof"
  ]
}
