{
  "correction_id": "bulk-obsolete-0as3-gpt61sol-20261015",
  "created_at": "2026-10-16T05:09:08.940424Z",
  "derivation_ids": {
    "tag:0B50:proof": "audit-bulk-obsolete-0as3-20261015"
  },
  "files": {
    "candidates": {
      "hash": "sha256:ae1290abe1752465eb96313f383aaf0d8b628f926b5bff37ab96819d849d6c45",
      "path": "translation-data/retired/model-corrections/bulk-obsolete-0as3-gpt61sol-20261015/candidates.jsonl"
    },
    "units": {
      "hash": "sha256:8f59b5920da6c29dd8fa6c3fb6f33beb0ffdd70eecd268b1af1410a30165a4c1",
      "path": "translation-data/retired/model-corrections/bulk-obsolete-0as3-gpt61sol-20261015/units.jsonl"
    }
  },
  "run_id": "run-20261015-bulk-obsolete-0as3-gpt61sol",
  "schema_version": 1,
  "source_commit": "a04446e57ec1fbc252a871afcec7752fb2807b14",
  "unit_ids": [
    "tag:0B50:proof"
  ]
}
