{
  "correction_id": "bulk-desirables-02bl-gpt61sol-20261015",
  "created_at": "2026-10-16T05:09:08.940424Z",
  "derivation_ids": {
    "tag:02BL:prose-0001": "audit-bulk-desirables-02bl-20261015",
    "tag:02BL:title": "audit-bulk-desirables-02bl-20261015"
  },
  "files": {
    "candidates": {
      "hash": "sha256:8fd96bfa26f7d484bd3ac7607fa0da5723ebcd1038f797ae1c3218bcae6b931b",
      "path": "translation-data/retired/model-corrections/bulk-desirables-02bl-gpt61sol-20261015/candidates.jsonl"
    },
    "units": {
      "hash": "sha256:79abedd2f047e8d7529e0894e1e0c1ef614acbf747b0eb2738c43a65a9e8bee5",
      "path": "translation-data/retired/model-corrections/bulk-desirables-02bl-gpt61sol-20261015/units.jsonl"
    }
  },
  "run_id": "run-20261015-bulk-desirables-02bl-gpt61sol",
  "schema_version": 1,
  "source_commit": "a04446e57ec1fbc252a871afcec7752fb2807b14",
  "unit_ids": [
    "tag:02BL:title",
    "tag:02BL:prose-0001"
  ]
}
