{
  "correction_id": "bulk-conventions-0004-gpt61sol-20261015",
  "created_at": "2026-10-16T05:09:08.940424Z",
  "derivation_ids": {
    "tag:0004:paragraph-0001": "audit-bulk-conventions-0004-20261015",
    "tag:0004:title": "audit-bulk-conventions-0004-20261015"
  },
  "files": {
    "candidates": {
      "hash": "sha256:1f33f35a817228f920d85d377c24eb14f61272d9fa8b9cdf6ee6685d9d303876",
      "path": "translation-data/retired/model-corrections/bulk-conventions-0004-gpt61sol-20261015/candidates.jsonl"
    },
    "units": {
      "hash": "sha256:ae242fc4718a7fde7beb97bbe4631f43e0fdb9ebfcfede7bd9881dcd65ef68c6",
      "path": "translation-data/retired/model-corrections/bulk-conventions-0004-gpt61sol-20261015/units.jsonl"
    }
  },
  "run_id": "run-20261015-bulk-conventions-0004-gpt61sol",
  "schema_version": 1,
  "source_commit": "a04446e57ec1fbc252a871afcec7752fb2807b14",
  "unit_ids": [
    "tag:0004:title",
    "tag:0004:paragraph-0001"
  ]
}
