{
  "correction_id": "categories-definitions-complete-gpt6astra-20261013",
  "created_at": "2026-10-13T02:28:29.581735Z",
  "derivation_ids": {
    "tag:0013:paragraph-0002": "audit-categories-0015-definitions-complete-20261013",
    "tag:0013:paragraph-0003": "audit-categories-0017-definitions-complete-20261013",
    "tag:0014:statement": "audit-categories-0014-definitions-complete-20261013",
    "tag:0015:statement": "audit-categories-0015-definitions-complete-20261013",
    "tag:0016:statement": "audit-categories-0016-definitions-complete-20261013",
    "tag:0017:statement": "audit-categories-0017-definitions-complete-20261013",
    "tag:0018:statement": "audit-categories-0018-definitions-complete-20261013",
    "tag:0019:statement": "audit-categories-0019-definitions-complete-20261013"
  },
  "files": {
    "candidates": {
      "hash": "sha256:afbd5d29ffed29f8f661737d0bd97d9954216dcf06cb148d23a42305d9ae5da2",
      "path": "translation-data/retired/model-corrections/categories-definitions-complete-gpt6astra-20261013/candidates.jsonl"
    },
    "units": {
      "hash": "sha256:c6336d4985d6222b84cacf0c9fc31164ca814bf16b78192492b76d2e2b27bb90",
      "path": "translation-data/retired/model-corrections/categories-definitions-complete-gpt6astra-20261013/units.jsonl"
    }
  },
  "run_id": "run-20261013-categories-definitions-complete-gpt6astra",
  "schema_version": 1,
  "source_commit": "a04446e57ec1fbc252a871afcec7752fb2807b14",
  "unit_ids": [
    "tag:0014:statement",
    "tag:0013:paragraph-0002",
    "tag:0015:statement",
    "tag:0016:statement",
    "tag:0017:statement",
    "tag:0013:paragraph-0003",
    "tag:0018:statement",
    "tag:0019:statement"
  ]
}
