{
  "correction_id": "bulk-sets-000v-gpt6astra-20261015",
  "created_at": "2026-10-16T05:09:08.940424Z",
  "derivation_ids": {
    "tag:000V:proof": "audit-bulk-sets-000v-20261015",
    "tag:000V:statement": "audit-bulk-sets-000v-20261015"
  },
  "files": {
    "candidates": {
      "hash": "sha256:b455f89024d6f5b6c2b44117917d4b0b2ae88943e21090b63ed383b4845a5bd7",
      "path": "translation-data/retired/model-corrections/bulk-sets-000v-gpt6astra-20261015/candidates.jsonl"
    },
    "units": {
      "hash": "sha256:8448a35d744683b9e11c8e3813281c1180ecd7ce1b048241d6c547e1061c864f",
      "path": "translation-data/retired/model-corrections/bulk-sets-000v-gpt6astra-20261015/units.jsonl"
    }
  },
  "run_id": "run-20261015-bulk-sets-000v-gpt6astra",
  "schema_version": 1,
  "source_commit": "a04446e57ec1fbc252a871afcec7752fb2807b14",
  "unit_ids": [
    "tag:000V:statement",
    "tag:000V:proof"
  ]
}
