{
  "correction_id": "bulk-extra-categories-002e-gpt61sol-20261016",
  "created_at": "2026-10-16T05:09:08.940424Z",
  "derivation_ids": {
    "tag:002D:paragraph-0002": "audit-bulk-extra-categories-002e-20261016",
    "tag:002E:statement": "audit-bulk-extra-categories-002e-20261016"
  },
  "files": {
    "candidates": {
      "hash": "sha256:3fbb71b23b20be810972b349edaa0a834f21f78c361150cf67654875c1db3e6a",
      "path": "translation-data/retired/model-corrections/bulk-extra-categories-002e-gpt61sol-20261016/candidates.jsonl"
    },
    "units": {
      "hash": "sha256:5e40f871ca731093e18843591fb77a2cc904bb257244feab4aad3a01473ecd5b",
      "path": "translation-data/retired/model-corrections/bulk-extra-categories-002e-gpt61sol-20261016/units.jsonl"
    }
  },
  "run_id": "run-20261016-bulk-extra-categories-002e-gpt61sol",
  "schema_version": 1,
  "source_commit": "a04446e57ec1fbc252a871afcec7752fb2807b14",
  "unit_ids": [
    "tag:002E:statement",
    "tag:002D:paragraph-0002"
  ]
}
