{
  "correction_id": "bulk-sets-05n1-gpt6astra-20261015",
  "created_at": "2026-10-16T05:09:08.940424Z",
  "derivation_ids": {
    "tag:05N1:prose-0001": "audit-bulk-sets-05n1-20261015",
    "tag:05N1:title": "audit-bulk-sets-05n1-20261015"
  },
  "files": {
    "candidates": {
      "hash": "sha256:924e7e8d5ed3ede0b0b5545abb651dc2b99ba59f2d9ccad7fac410ecc1c039e8",
      "path": "translation-data/retired/model-corrections/bulk-sets-05n1-gpt6astra-20261015/candidates.jsonl"
    },
    "units": {
      "hash": "sha256:28226d5b0495bc2be177a21aabe09d3981fec612478eff732e1488e8aded01cf",
      "path": "translation-data/retired/model-corrections/bulk-sets-05n1-gpt6astra-20261015/units.jsonl"
    }
  },
  "run_id": "run-20261015-bulk-sets-05n1-gpt6astra",
  "schema_version": 1,
  "source_commit": "a04446e57ec1fbc252a871afcec7752fb2807b14",
  "unit_ids": [
    "tag:05N1:title",
    "tag:05N1:prose-0001"
  ]
}
