{
  "correction_id": "bulk-extra-categories-001e-gpt61sol-20261016",
  "created_at": "2026-10-16T05:09:08.940424Z",
  "derivation_ids": {
    "tag:001E:statement": "audit-bulk-extra-categories-001e-20261016"
  },
  "files": {
    "candidates": {
      "hash": "sha256:d7513d99f53820bc2e1d37937861afd30187748387b057b1a26bb5ffa150982e",
      "path": "translation-data/retired/model-corrections/bulk-extra-categories-001e-gpt61sol-20261016/candidates.jsonl"
    },
    "units": {
      "hash": "sha256:6e6d9f7e3ecf838b69df5b3c66a1359781a30c3e9fe132a666aee032ef3d4a76",
      "path": "translation-data/retired/model-corrections/bulk-extra-categories-001e-gpt61sol-20261016/units.jsonl"
    }
  },
  "run_id": "run-20261016-bulk-extra-categories-001e-gpt61sol",
  "schema_version": 1,
  "source_commit": "a04446e57ec1fbc252a871afcec7752fb2807b14",
  "unit_ids": [
    "tag:001E:statement"
  ]
}
