{
  "correction_id": "categories-fibre-examples-gpt61sol-20261014",
  "created_at": "2026-10-14T00:03:50.256258Z",
  "derivation_ids": {
    "tag:0020:prose-0001": "audit-categories-0020-fibre-examples-20261014",
    "tag:0020:title": "audit-categories-0020-fibre-examples-20261014",
    "tag:0021:title": "audit-categories-0021-fibre-examples-20261014",
    "tag:0022:proof": "audit-categories-0022-fibre-examples-20261014",
    "tag:0022:statement": "audit-categories-0022-fibre-examples-20261014"
  },
  "files": {
    "candidates": {
      "hash": "sha256:d1c939b31aac792324259ff48c7ecf71e63682864bdf227085daaac603e607e5",
      "path": "translation-data/retired/model-corrections/categories-fibre-examples-gpt61sol-20261014/candidates.jsonl"
    },
    "units": {
      "hash": "sha256:fcfb7b14bbd3d282d36115459bb70adcc4b85e174a73f40a5b7a0b7f2ecc8ecd",
      "path": "translation-data/retired/model-corrections/categories-fibre-examples-gpt61sol-20261014/units.jsonl"
    }
  },
  "run_id": "run-20261014-categories-fibre-examples-gpt61sol",
  "schema_version": 1,
  "source_commit": "a04446e57ec1fbc252a871afcec7752fb2807b14",
  "unit_ids": [
    "tag:0020:title",
    "tag:0020:prose-0001",
    "tag:0021:title",
    "tag:0022:statement",
    "tag:0022:proof"
  ]
}
