{
  "schema_version": 1,
  "correction_id": "categories-0ahm-named-title-gpt61sol-20261005",
  "run_id": "run-20261005-categories-0ahm-named-title-gpt61sol-02",
  "source_commit": "a04446e57ec1fbc252a871afcec7752fb2807b14",
  "created_at": "2026-10-05T11:45:44Z",
  "unit_ids": [
    "tag:0AHM:title",
    "tag:0AHM:p001",
    "tag:0AHN:statement",
    "tag:0AHN:proof-p001",
    "tag:0AHP:statement",
    "tag:0AHQ:statement",
    "tag:0AHQ:proof-p001"
  ],
  "derivation_ids": {
    "tag:0AHM:title": "categories-0ahm-named-title-20261005",
    "tag:0AHM:p001": "categories-0ahm-named-title-20261005",
    "tag:0AHN:statement": "categories-0ahm-named-title-20261005",
    "tag:0AHN:proof-p001": "categories-0ahm-named-title-20261005",
    "tag:0AHP:statement": "categories-0ahm-named-title-20261005",
    "tag:0AHQ:statement": "categories-0ahm-named-title-20261005",
    "tag:0AHQ:proof-p001": "categories-0ahm-named-title-20261005"
  },
  "files": {
    "units": {
      "path": "translation-data/retired/model-corrections/categories-0ahm-named-title-gpt61sol-20261005/units.jsonl",
      "hash": "sha256:8374b4fd167c516d0cfbcc06f89bf39c2f0e2a9a215cfce4d517456a2c2a4488"
    },
    "candidates": {
      "path": "translation-data/retired/model-corrections/categories-0ahm-named-title-gpt61sol-20261005/candidates.jsonl",
      "hash": "sha256:75ade354c837d3c64555eb31afb79ca4d2b7e2c92e22ce6c7cecb910701241dd"
    }
  }
}
