{
  "correction_id": "bulk-obsolete-0d45-gpt6astra-20261015",
  "created_at": "2026-10-16T05:09:08.940424Z",
  "derivation_ids": {
    "tag:07V2:proof": "audit-bulk-obsolete-0d45-20261015",
    "tag:07V2:statement": "audit-bulk-obsolete-0d45-20261015",
    "tag:07V3:proof": "audit-bulk-obsolete-0d45-20261015",
    "tag:07V3:statement": "audit-bulk-obsolete-0d45-20261015",
    "tag:0AKU:statement": "audit-bulk-obsolete-0d45-20261015",
    "tag:0AKV:statement": "audit-bulk-obsolete-0d45-20261015",
    "tag:0D45:prose-0001": "audit-bulk-obsolete-0d45-20261015",
    "tag:0D45:title": "audit-bulk-obsolete-0d45-20261015"
  },
  "files": {
    "candidates": {
      "hash": "sha256:0b674a3f30245b8050501cf545672c7804796b9039e845ed5dc3e22b1a4d8d46",
      "path": "translation-data/retired/model-corrections/bulk-obsolete-0d45-gpt6astra-20261015/candidates.jsonl"
    },
    "units": {
      "hash": "sha256:9f6bc56787766f678dc0afa974c511442b20d59f5647adf160e89fde4c860ed5",
      "path": "translation-data/retired/model-corrections/bulk-obsolete-0d45-gpt6astra-20261015/units.jsonl"
    }
  },
  "run_id": "run-20261015-bulk-obsolete-0d45-gpt6astra",
  "schema_version": 1,
  "source_commit": "a04446e57ec1fbc252a871afcec7752fb2807b14",
  "unit_ids": [
    "tag:0D45:title",
    "tag:0D45:prose-0001",
    "tag:07V2:statement",
    "tag:07V2:proof",
    "tag:07V3:statement",
    "tag:07V3:proof",
    "tag:0AKU:statement",
    "tag:0AKV:statement"
  ]
}
