{
  "correction_id": "bulk-extra-categories-001h-gpt61sol-20261016",
  "created_at": "2026-10-16T05:09:08.940424Z",
  "derivation_ids": {
    "tag:001H:statement": "audit-bulk-extra-categories-001h-20261016"
  },
  "files": {
    "candidates": {
      "hash": "sha256:43cfde6e60351ce043a25715a60b8b2ee8955fd6a837167418da947881204eea",
      "path": "translation-data/retired/model-corrections/bulk-extra-categories-001h-gpt61sol-20261016/candidates.jsonl"
    },
    "units": {
      "hash": "sha256:9bad6a796a3a664284a22ac3297f78387fc0f6dc76687bc4cdebd0b6b8fba0b4",
      "path": "translation-data/retired/model-corrections/bulk-extra-categories-001h-gpt61sol-20261016/units.jsonl"
    }
  },
  "run_id": "run-20261016-bulk-extra-categories-001h-gpt61sol",
  "schema_version": 1,
  "source_commit": "a04446e57ec1fbc252a871afcec7752fb2807b14",
  "unit_ids": [
    "tag:001H:statement"
  ]
}
