{
  "correction_id": "bulk-extra-categories-001d-gpt61sol-20261016",
  "created_at": "2026-10-16T05:09:08.940424Z",
  "derivation_ids": {
    "tag:0013:paragraph-0005": "audit-bulk-extra-categories-001d-20261016",
    "tag:001D:statement": "audit-bulk-extra-categories-001d-20261016"
  },
  "files": {
    "candidates": {
      "hash": "sha256:49fd14040ae7bd4db125f4abf7e2af819d9facaa9585adf10fb3974f6c96ea84",
      "path": "translation-data/retired/model-corrections/bulk-extra-categories-001d-gpt61sol-20261016/candidates.jsonl"
    },
    "units": {
      "hash": "sha256:c91daa8fd49912012cc15bbe6457ef76969188e7affad0301e169b1683f48cc2",
      "path": "translation-data/retired/model-corrections/bulk-extra-categories-001d-gpt61sol-20261016/units.jsonl"
    }
  },
  "run_id": "run-20261016-bulk-extra-categories-001d-gpt61sol",
  "schema_version": 1,
  "source_commit": "a04446e57ec1fbc252a871afcec7752fb2807b14",
  "unit_ids": [
    "tag:001D:statement",
    "tag:0013:paragraph-0005"
  ]
}
