{
  "correction_id": "bulk-fdl-02c1-gpt61sol-20261015",
  "created_at": "2026-10-16T05:09:08.940424Z",
  "derivation_ids": {
    "tag:02C1:prose-0001": "audit-bulk-fdl-02c1-20261015",
    "tag:02C1:title": "audit-bulk-fdl-02c1-20261015"
  },
  "files": {
    "candidates": {
      "hash": "sha256:793530d819704e71b1b156a27ab00f34af87f7d01d9a24cfc95e175fe5ef72d8",
      "path": "translation-data/retired/model-corrections/bulk-fdl-02c1-gpt61sol-20261015/candidates.jsonl"
    },
    "units": {
      "hash": "sha256:6275d362b5787e775d8272d0dbfb77c5755eb885f148eb87b6ed8daef7f81d85",
      "path": "translation-data/retired/model-corrections/bulk-fdl-02c1-gpt61sol-20261015/units.jsonl"
    }
  },
  "run_id": "run-20261015-bulk-fdl-02c1-gpt61sol",
  "schema_version": 1,
  "source_commit": "a04446e57ec1fbc252a871afcec7752fb2807b14",
  "unit_ids": [
    "tag:02C1:title",
    "tag:02C1:prose-0001"
  ]
}
