{
  "correction_id": "bulk-extra-categories-0035-gpt61sol-20261016",
  "created_at": "2026-10-16T05:09:08.940424Z",
  "derivation_ids": {
    "tag:0035:proof": "audit-bulk-extra-categories-0035-20261016",
    "tag:0035:statement": "audit-bulk-extra-categories-0035-20261016"
  },
  "files": {
    "candidates": {
      "hash": "sha256:73dcfc1ab7e2dd28073a7768592346b17e2aeebbd5e046defe89771436241fcb",
      "path": "translation-data/retired/model-corrections/bulk-extra-categories-0035-gpt61sol-20261016/candidates.jsonl"
    },
    "units": {
      "hash": "sha256:5a9d1b53ff3bd76881f3889e61403c3f5dc209f8225609b6ad38073a84dd0674",
      "path": "translation-data/retired/model-corrections/bulk-extra-categories-0035-gpt61sol-20261016/units.jsonl"
    }
  },
  "run_id": "run-20261016-bulk-extra-categories-0035-gpt61sol",
  "schema_version": 1,
  "source_commit": "a04446e57ec1fbc252a871afcec7752fb2807b14",
  "unit_ids": [
    "tag:0035:statement",
    "tag:0035:proof"
  ]
}
