{
  "correction_id": "bulk-introduction-0001-gpt61sol-20261015",
  "created_at": "2026-10-16T05:09:08.940424Z",
  "derivation_ids": {
    "tag:0000:title": "audit-bulk-introduction-0001-20261015",
    "tag:0001:prose-0001": "audit-bulk-introduction-0001-20261015",
    "tag:0001:title": "audit-bulk-introduction-0001-20261015"
  },
  "files": {
    "candidates": {
      "hash": "sha256:88d48a6bbc49a6247de91d630e1971e82fad09ec941b2b480b85b218e89aaf97",
      "path": "translation-data/retired/model-corrections/bulk-introduction-0001-gpt61sol-20261015/candidates.jsonl"
    },
    "units": {
      "hash": "sha256:40ac2e4479c7e7bc8897ff73640a3230f20ce986243cfa06784eba4f3768bf46",
      "path": "translation-data/retired/model-corrections/bulk-introduction-0001-gpt61sol-20261015/units.jsonl"
    }
  },
  "run_id": "run-20261015-bulk-introduction-0001-gpt61sol",
  "schema_version": 1,
  "source_commit": "a04446e57ec1fbc252a871afcec7752fb2807b14",
  "unit_ids": [
    "tag:0000:title",
    "tag:0001:title",
    "tag:0001:prose-0001"
  ]
}
