{
  "correction_id": "bulk-sets-0009-gpt61sol-20261015",
  "created_at": "2026-10-16T05:09:08.940424Z",
  "derivation_ids": {
    "tag:0009:prose-0001": "audit-bulk-sets-0009-20261015",
    "tag:0009:title": "audit-bulk-sets-0009-20261015"
  },
  "files": {
    "candidates": {
      "hash": "sha256:632dc035c6ec788fbd9f6e832e7c95490f12dd56a423f59346b5104f45125227",
      "path": "translation-data/retired/model-corrections/bulk-sets-0009-gpt61sol-20261015/candidates.jsonl"
    },
    "units": {
      "hash": "sha256:d3f8d42764ec1b21bcdb8ef4f5a402939898d4ad9c465e0b8dda82d4473730dc",
      "path": "translation-data/retired/model-corrections/bulk-sets-0009-gpt61sol-20261015/units.jsonl"
    }
  },
  "run_id": "run-20261015-bulk-sets-0009-gpt61sol",
  "schema_version": 1,
  "source_commit": "a04446e57ec1fbc252a871afcec7752fb2807b14",
  "unit_ids": [
    "tag:0009:title",
    "tag:0009:prose-0001"
  ]
}
