{
  "correction_id": "bulk-desirables-02bu-gpt61sol-20261015",
  "created_at": "2026-10-16T05:09:08.940424Z",
  "derivation_ids": {
    "tag:02BU:paragraph-0001": "audit-bulk-desirables-02bu-20261015",
    "tag:02BU:title": "audit-bulk-desirables-02bu-20261015"
  },
  "files": {
    "candidates": {
      "hash": "sha256:521bee2e216a0e111c3156960c79655f7c59f75326e70d43e73a95b35d399b2a",
      "path": "translation-data/retired/model-corrections/bulk-desirables-02bu-gpt61sol-20261015/candidates.jsonl"
    },
    "units": {
      "hash": "sha256:13d9c7923b26759ee972c4fcb985c6e4c0e3d5f2d35db47dc8a08040d0d59565",
      "path": "translation-data/retired/model-corrections/bulk-desirables-02bu-gpt61sol-20261015/units.jsonl"
    }
  },
  "run_id": "run-20261015-bulk-desirables-02bu-gpt61sol",
  "schema_version": 1,
  "source_commit": "a04446e57ec1fbc252a871afcec7752fb2807b14",
  "unit_ids": [
    "tag:02BU:title",
    "tag:02BU:paragraph-0001"
  ]
}
